,user_id,user_name,tweet_time,location,text,sentiment
304,45379403,"Davy ""Three Cakes"" Acko",Tue Aug 28 19:59:22 +0000 2018,Liverpool,if human rights champion means volunteering to bomb civilianschampioning every war the us has been involved in t,neutral
305,713781393684369408,American Dean  ,Tue Aug 28 19:59:22 +0000 2018,America ,i can only imagine how awkward you must have felt when obama snubbed nancy reagans funeral,negative
306,3596687292,CNN is the MSM ShitHole,Tue Aug 28 19:59:23 +0000 2018,Behind Enemy Lines - Peoples Republic of Kalifornia,what does it say about a member of msm who secretly funneled advance questions to a crooked clinton in preparation of a,negative
307,2830808444,Brother David,Tue Aug 28 19:59:23 +0000 2018,#DarlaHouse:is#GodsHouse,mccain told him not to you moron why dont you tell us what happened to sethrich you wildebeest,negative
308,3237290462,Lilianny Leebou,Tue Aug 28 19:59:23 +0000 2018,United States,tried to get those pills but republicans,irrelevant
309,2335979792,Skatrgurrl,Tue Aug 28 19:59:24 +0000 2018,Canada,it is indeed sad to see he gave up so much for the love of his country a true hero whi,positive
310,385150206,Shane,Tue Aug 28 19:59:25 +0000 2018,Florida USA,gold the things potus trump cares about google crowdsize etc vs not puertorico johnmccain etc is some,neutral
311,166679288,Heron,Tue Aug 28 19:59:25 +0000 2018,None,kelli ward really how utterly stupid do you have to be to believe that ended medical treatment to sp,negative
312,854796534239510528,Anna Smith,Tue Aug 28 19:59:26 +0000 2018,None,someone got to amp made him lower the flag to honor you know he hated doing it because hes,negative
313,22922231,Jadelia Mackay,Tue Aug 28 19:59:26 +0000 2018,Maine USA,under pressure from american legion trump orders flag lowered at white house and other govt buildings until,negative
314,835508264053932033,Tess,Tue Aug 28 19:59:27 +0000 2018,United States,one of a few stories you will not read about john mccain in vietnams staterun media would be his close ties with the huma,negative
315,2529044971,Warrior Grandma,Tue Aug 28 19:59:27 +0000 2018,West Coast,today is a good day to remember the real reason trump has such hatred for the patriot who obtained amp th,positive
316,1010604030274355200,Shellie Ash-Jones,Tue Aug 28 19:59:28 +0000 2018,Missouri USA,you can be bipartisan on this issue but not on matters of state,irrelevant
317,830905941855989761,Maureen,Tue Aug 28 19:59:28 +0000 2018,None,now cancelling the super bowl visit because the eagles werent gonna come anyway just as the warriors didnt wanna come so h,positive
318,3697180403,Zaidie,Tue Aug 28 19:59:28 +0000 2018,None,kelli ward really how utterly stupid do you have to be to believe that ended medical treatment to sp,negative
319,561585380,Muchachat,Tue Aug 28 19:59:29 +0000 2018,Montral Qubec,very lovely tribute to by do you really want to honor your friend john denounce,positive
320,346339018,Sandra Bridges,Tue Aug 28 19:59:29 +0000 2018,Tampa Florida,well sir he didnt just talk the talk he walked the wall can you,irrelevant
321,170716826,Jenn {} ,Tue Aug 28 19:59:29 +0000 2018,GreatLakesGirl GAB-PatriotJenn,i can only imagine how awkward you must have felt when obama snubbed nancy reagans funeral,negative
322,919663080,Lawrence Chance,Tue Aug 28 19:59:31 +0000 2018,North Carolina,when is cnn going to stop giving santorum to stink up their programming,irrelevant
323,827929898236911620,BicMob,Tue Aug 28 19:59:31 +0000 2018,Minnesota USA,trump johnmccain its ironic that trump and his like are so offended by the fictional disrespect to our veterans,positive
324,852143645876736000,Anita Springer,Tue Aug 28 19:59:31 +0000 2018,North Central TexasUSA,i wasnt going to do this but the media and nevertrump fawning over senator mccain as a way to bash presid,neutral
325,916685292370841601,Dennis L Grote,Tue Aug 28 19:59:33 +0000 2018,Burlington VT,thank you on arden way in sacramento for keeping flags at half staff in honor of,negative
326,22501421,Nadine,Tue Aug 28 19:59:33 +0000 2018,None,red what does it say about america when john mccain can be considered an american icon,neutral
327,505255284,charles comus,Tue Aug 28 19:59:33 +0000 2018,new orleans,math why do you foist santorum upon your viewers,irrelevant
328,154066663,Justiceis Mueller ,Tue Aug 28 19:59:34 +0000 2018,None,thats bullshit mckinnon and from this was born a great friendship and then a partnership remembers,positive
329,1548567426,BADRIDER,Tue Aug 28 19:59:34 +0000 2018,Connecticut USA,remember ur actions speak louder then ur words we do sympathize with u for ur loss,irrelevant
330,1679811914,Elizabeth Lee Carron,Tue Aug 28 19:59:34 +0000 2018,Virginia USA,cat sometimes we get it right sometimes we dont johnmccain got it wrong in death he could have brought pple together exten,negative
331,1025863129668968449,tiffanynevertrump,Tue Aug 28 19:59:35 +0000 2018,None,kelli ward really how utterly stupid do you have to be to believe that ended medical treatment to sp,negative
332,1034524265020841985,jenette harris,Tue Aug 28 19:59:36 +0000 2018,None,bittersweet memories of powmia bracelets no soldier forgotten,irrelevant
333,822078666,(((Danny Boy))),Tue Aug 28 19:59:37 +0000 2018,Yorkshire United Kingdom,ive written to calling for the new headquarters to be named after few have given,negative
334,1379675096,Erin Cooksley,Tue Aug 28 19:59:37 +0000 2018,San Francisco CA,dems are praising and wanting to name buildings after him meanwhile the is calling him out for,irrelevant
335,340528245,Denis Wauchope,Tue Aug 28 19:59:37 +0000 2018,Carlsbad CA USA,trump why was johnmccain military record sealed nixon had to pardon him mccain was a traitorthe term hero is no where app,negative
336,25207598,BrunoTX #DemForce,Tue Aug 28 19:59:39 +0000 2018,Texas USA,holy crap says the media is using the president disrespecting to victimize,negative
337,706644748526874624,Susie D,Tue Aug 28 19:59:39 +0000 2018,United States,was this before or after he defended trumps treatment of mccain and threw,neutral
338,498316263,mbt _ brannon,Tue Aug 28 19:59:39 +0000 2018,United States,johnmccain a globalist who posed as a us senator helped arm isis and enriched himself while innocent men wome,positive
339,204386512,Fox News Video,Tue Aug 28 19:59:41 +0000 2018,U.S.A.,sen delivers afteraction report on johnmccain,neutral
340,36191695,DNews Politics,Tue Aug 28 19:59:41 +0000 2018,Salt Lake City Utah,us ambassador to russia a former utah governor and have long history utpol,negative
341,809305110,Des Haml,Tue Aug 28 19:59:42 +0000 2018,None,kelli ward really how utterly stupid do you have to be to believe that ended medical treatment to sp,negative
342,1010944632237297665,TrueBlueReport,Tue Aug 28 19:59:42 +0000 2018,United States,you have shown no loyalty or support for your deceased friend and colleague you,irrelevant
343,19481732,HopeSpringsATurtle,Tue Aug 28 19:59:42 +0000 2018,Eagle Rock ,i wish the air force would take away his commission,irrelevant
344,1029855486827364352,2drinkminimum,Tue Aug 28 19:59:42 +0000 2018,None,when received the steele dossier and saw manafort putin and yanukovychs name in the same sentence he imme,neutral
345,184569036,Kim G.,Tue Aug 28 19:59:43 +0000 2018,None,you disgrace the memory of mccain you cant even honor his last words to you cou,neutral
346,831651493329580032,Marty,Tue Aug 28 19:59:44 +0000 2018,California USA,ditto ditto ditto did he not carry the fake dossier and hand it to someone acting like it was the real deal kno,negative
347,3053219203,Christi Johnson,Tue Aug 28 19:59:44 +0000 2018,None,kelli ward really how utterly stupid do you have to be to believe that ended medical treatment to sp,negative
348,28564406,robinslj,Tue Aug 28 19:59:44 +0000 2018,Massachusetts USA,at reagans funeral thatcher sat next to gorbachevand at johnmccains funeral obama will give a eulogy that is how r,neutral
349,786093031321731072,karole,Tue Aug 28 19:59:46 +0000 2018,None,listen up you twat waffle senate seats are not just passed down like a piece of furniture in a family will we are deman,negative
350,2738632115,Kim T,Tue Aug 28 19:59:46 +0000 2018,None,im old enough to remember when lindseygraham was considered to be johnmccains partner in resisting some of trumps exces,positive
351,891474451195240448,Deplorable in Canada,Tue Aug 28 19:59:47 +0000 2018,None,what does it say about that she apparently showed up at the hospital right after sethrich was shot,positive
352,894981124643897344, z ,Tue Aug 28 19:59:49 +0000 2018, ,holy crap says the media is using the president disrespecting to victimize,negative
353,2511274210,Desiree,Tue Aug 28 19:59:49 +0000 2018,None,your father is gone but keep his spirit alive that is your conviction and your connection i have been wher,positive
354,16439521,Don Seiler,Tue Aug 28 19:59:49 +0000 2018,Tomball TX,if youve been banned from two funerals and a wedding make no mistake you are an asshole tuesdaythoughts barbar,irrelevant
355,2893026960,Arthur Sharp,Tue Aug 28 19:59:49 +0000 2018,Columbus OH,cat sometimes we get it right sometimes we dont johnmccain got it wrong in death he could have brought pple together exten,negative
356,958837405368373248,Rocket City Dixie,Tue Aug 28 19:59:49 +0000 2018,Huntsville AL,i can only imagine how awkward you must have felt when obama snubbed nancy reagans funeral,negative
357,3061807265,Linda Jackson,Tue Aug 28 19:59:50 +0000 2018,Fort Wayne IN,desk on the senate floor,irrelevant
358,885146622509830144,Rev. Dr. Madlyn Ruch,Tue Aug 28 19:59:50 +0000 2018,None,the best way to honor legacy and apparently his final wish would be for his wife cindy to be name,positive
359,797092188022800384,Jon (#babytrump),Tue Aug 28 19:59:51 +0000 2018,None,all military amp veterans recognize that the commander amp chief didnt want to recognize a veteran,negative
360,1686568830,CD in CHI ,Tue Aug 28 19:59:52 +0000 2018,Chicago,amen,irrelevant
361,968712288969592832,Wizard,Tue Aug 28 19:59:52 +0000 2018,Massachusetts ,me hes dancing on a tightrope,irrelevant
362,893641529386053633,jelly girl/bitchy bear/,Tue Aug 28 19:59:52 +0000 2018,Planet Earth flat ,cat 2008 johnmccain is mentally unfit to be president 2012 johnmccain is a racist and a woman hater,negative
363,823659580978663424,rae piha,Tue Aug 28 19:59:52 +0000 2018,None,i agree republicans grow a backbone trump did not continue to fly our flag at half m,positive
364,25552705,jlee,Tue Aug 28 19:59:53 +0000 2018,None,yes and what about the part where he said john mccain taught about compromise that the other side must get somethi,negative
365,972702955,Don Sanders ,Tue Aug 28 19:59:53 +0000 2018,Annapolis MD,the real john mccain was a very bitter manto the very end so sad,negative
366,587737444,Paul Grandsinger,Tue Aug 28 19:59:54 +0000 2018,California USA,holy crap says the media is using the president disrespecting to victimize,negative
367,987499799317532672,robert brill,Tue Aug 28 19:59:54 +0000 2018,None,blue water sailors we salute our fallen comrade hr299 please help,neutral
368,3237290462,Lilianny Leebou,Tue Aug 28 19:59:54 +0000 2018,United States,being outraged about war is perfectly natural m,negative
369,3322616113,45=Phenominally Bad - #BlueWave2018 ,Tue Aug 28 19:59:55 +0000 2018,San Diego CA,im old enough to remember when lindseygraham was considered to be johnmccains partner in resisting some of trumps exces,positive
370,70839845,Michelle,Tue Aug 28 19:59:54 +0000 2018,Philadelphia PA,kelli ward really how utterly stupid do you have to be to believe that ended medical treatment to sp,negative
371,4736690237,Maike,Tue Aug 28 19:59:55 +0000 2018,None,very lovely tribute to by do you really want to honor your friend john denounce,positive
372,816011957849337856,Linda Eck,Tue Aug 28 19:59:56 +0000 2018,Apache Junction AZ,if you really want to honor then stand up to as he did show a w,positive
373,808891990465245184,Violeta Bostioca,Tue Aug 28 19:59:56 +0000 2018,Sterling Heights MI,i am a democrat who respects mccain republicans i despise nonmccain republicans and you are one of them,neutral
374,4746444355,#WalkAway ,Tue Aug 28 19:59:57 +0000 2018,San Miguel California,mccain publicly asked that he not attend potus is respecting a dying mans last request its about mccain amp family no,neutral
375,3039617697,NOT PC,Tue Aug 28 19:59:58 +0000 2018,None,followthewhiterabbit qanon greatawakening spygate maga igreport walkaway qanon johnmccain white house cmaawards,neutral
376,43342743,FOX 47 News,Tue Aug 28 20:00:00 +0000 2018,Lansing Michigan,livonia woman who prayed for johnmccain as a pow shares letter from the senator johnmccainrip,neutral
377,961035838732816385,BubbleGum,Tue Aug 28 20:00:00 +0000 2018,None,integrate k e a t i n g,irrelevant
378,178528687,Deb Worley,Tue Aug 28 20:00:00 +0000 2018,Iowa USA,the best way to honor legacy and apparently his final wish would be for his wife cindy to be name,positive
379,768463028266295297,Lee Marvinwannab,Tue Aug 28 20:00:00 +0000 2018,Pittsburgh PA,cry me a river of those crocodile tears your pretend sniffles and wavering voice while talking about,irrelevant
380,3383828055,#TrumpRussia LIVE,Tue Aug 28 20:00:01 +0000 2018,Washington DC,mccains brain tumor should be nominated for the next nobel peace prize johnmccain,neutral
381,1024443578389540864,Merry loy,Tue Aug 28 20:00:03 +0000 2018,Kansas City MO,very lovely tribute to by do you really want to honor your friend john denounce,positive
382,479089079,Bill Bertram,Tue Aug 28 20:00:03 +0000 2018,Father coach Proud Never-Trumper. Give me Bears and Badgers or give me death. I don't abide #treasonweasels,lets hope she has more comments like this so we can turn that seat blue,positive
383,824033119456137216,Hester Cool,Tue Aug 28 20:00:03 +0000 2018,None,cry me a river of those crocodile tears your pretend sniffles and wavering voice while talking about,irrelevant
384,835508264053932033,Tess,Tue Aug 28 20:00:04 +0000 2018,United States,duluth navy veteran david wheatwho was held captive during the vietnam war w amp recalls using handsignal,positive
385,988084104,Lt. Evergreen ,Tue Aug 28 20:00:05 +0000 2018,At sea underway as before.,we weaken our greatness when we confuse our patriotism with tribal rivalries that have sown resentment and hatred and violen,irrelevant
386,411621494,judy morris,Tue Aug 28 20:00:06 +0000 2018,Delaware USA,johnmccain is and has always been an american hating sociopath the cruel crude and unspeakable evil,negative
387,2616233653,LIBERTY IS #1,Tue Aug 28 20:00:07 +0000 2018,None,ditto ditto ditto did he not carry the fake dossier and hand it to someone acting like it was the real deal knowing it,negative
388,838214213801668608,PURPLERAIN2018,Tue Aug 28 20:00:08 +0000 2018,None,you are not his friend u were not a friend stop with the bs already you are a kgb,irrelevant
389,230279693,Sarah Wenig,Tue Aug 28 20:00:08 +0000 2018,Free Agent in Boston MA,the best tribute would be to stop kowtowing to trump,positive
390,104531272,Mario Soto,Tue Aug 28 20:00:09 +0000 2018,So. California USA,and yet this man somehow equates kneeling at a football game as unamerican what is it that you are apparently pr,negative
391,824705293514932226,MiMi,Tue Aug 28 20:00:09 +0000 2018,None,hes no man hell he aint even a mouse that prepared statement that he was forced to read was,negative
392,3368115981,nancy,Tue Aug 28 20:00:10 +0000 2018,Atlanta GA,if youve been banned from two funerals and a wedding make no mistake you are an asshole tuesdaythoughts barbar,irrelevant
393,82490831,Andrew Doll,Tue Aug 28 20:00:11 +0000 2018,Durham NC,the best way to honor legacy and apparently his final wish would be for his wife cindy to be name,positive
394,2904756511,Brian Jennings,Tue Aug 28 20:00:11 +0000 2018,None,,irrelevant
395,47777707,julie risko,Tue Aug 28 20:00:12 +0000 2018,None,the best way to honor legacy and apparently his final wish would be for his wife cindy to be name,positive
396,2312902755,Dan Herrin ,Tue Aug 28 20:00:13 +0000 2018,Birmingham AL,unseen it says our leader respects the final wishes of the deceased thats class obama would have ignored whatever the perso,neutral
397,425950001,mary weaver,Tue Aug 28 20:00:13 +0000 2018,None,dump santorum lying pos hes on i grab the remote,negative
398,74652492,maryjane ,Tue Aug 28 20:00:13 +0000 2018,Wisconsin USA,im old enough to remember when lindseygraham was considered to be johnmccains partner in resisting some of trumps exces,positive
399,786641041860329473,NoSheDidntxo,Tue Aug 28 20:00:16 +0000 2018,Alberta Canada,johnmccain is the last true republican that proved just because you dont agree on everything th,positive
400,256251541,SundayGirl727,Tue Aug 28 20:00:16 +0000 2018,None,what does it say trump is a great judge or character or lack thereof its beyond how drats love songbirdits bec,positive
401,817488870686101504,Sandy Alano,Tue Aug 28 20:00:17 +0000 2018,None,if you really want to honor then stand up to as he did show a w,positive
402,1269396228,Reid A. T. Leaf,Tue Aug 28 20:00:18 +0000 2018,None,to bad you arent,negative
403,16245302,Shari2112 ,Tue Aug 28 20:00:19 +0000 2018,Phoenix AZ,kelli ward really how utterly stupid do you have to be to believe that ended medical treatment to sp,negative
404,775004950971740160,Arthur,Tue Aug 28 20:00:19 +0000 2018,New Britain CT,yes he did lindsey speaking today of sen john mccain moved me i,neutral
405,918521193988329473,Romald Haresty 1046,Tue Aug 28 20:00:20 +0000 2018,Pennsylvania USA,demsmsm in 08 john mccain is a racist traitor and a womanizing bigot johnmccain despised president trump knowingly ga,neutral
406,236062721,Josefina Holmes,Tue Aug 28 20:00:21 +0000 2018,Anderson California,senator russell was a bigot and a racist in full view his name on that building is a disgrace it is only right th,positive
407,1677012432,Seagull,Tue Aug 28 20:00:21 +0000 2018,None,to be clear using our flag in such a vindictive manner is more disrespectful than nfl players taking a knee against po,positive
408,964700316875837440,Chey B Root,Tue Aug 28 20:00:21 +0000 2018,None,in the early 70s i started wearing a powmia bracelet randomly my soldier was john mccain in 1973 i watched him on t,negative
409,396348963,Spock's Marshmellon,Tue Aug 28 20:00:21 +0000 2018,Yosemite ,isnt she an md,irrelevant
410,3237290462,Lilianny Leebou,Tue Aug 28 20:00:22 +0000 2018,United States,too bad we all cant simply chill out and liv,negative
411,926289287729090560,Audra,Tue Aug 28 20:00:22 +0000 2018,Texas USA,even those in foreign countries agree mccain was a traitor and warmonger,negative
412,66540938,SuperEliteNewRightPatriot,Tue Aug 28 20:00:22 +0000 2018,Iowa USA,unseen it says our leader respects the final wishes of the deceased thats class obama would have ignored whatever the perso,neutral
413,514038892,Turk182,Tue Aug 28 20:00:22 +0000 2018,None,greer did you attend seth richs funeral or did you just send flowers and debate questions,irrelevant
414,315477574,I'mASmellyTrumpHillBillyHispanic,Tue Aug 28 20:00:22 +0000 2018,None,mccain publicly asked that he not attend potus is respecting a dying mans last request its about mccain amp family no,neutral
415,966906066058424320,James Smiley,Tue Aug 28 20:00:23 +0000 2018,None,if youve been banned from two funerals and a wedding make no mistake you are an asshole tuesdaythoughts barbar,irrelevant
416,858716365028458497,Nancy Ward,Tue Aug 28 20:00:24 +0000 2018,None,plora it says is respecting mccains wishes what does your icons request say about him bitter,negative
417,633072635,Roy Sheppard,Tue Aug 28 20:00:24 +0000 2018,Nova Scotia Canada,very lovely tribute to by do you really want to honor your friend john denounce,positive
418,3286758685,Wanda Essler,Tue Aug 28 20:00:25 +0000 2018,TEMPLE TEXAS ,we could really use a president johnmccain tuesdaythoughts,positive
419,823522731333484544,Alice Keck,Tue Aug 28 20:00:26 +0000 2018,Maryland,awoke the angels of our better nature amp inspired todays jillspin sent by a fan who knew one day wed h,positive
420,948979372848922625,Cheshire Cat,Tue Aug 28 20:00:26 +0000 2018,In Your Head,it was an honor to protect during his candidacy for president phoenix may you rest in peace,irrelevant
421,967175216378990592,MyHammy218,Tue Aug 28 20:00:27 +0000 2018,AMERICA,mccain didnt want to attend so he is doing the right thing and respecting his wishes if he did go this idiot woul,negative
422,62092084,Jazziette Devereaux,Tue Aug 28 20:00:28 +0000 2018,Scottsdale AZ,im not going to be a hypocrite i will never forgive johnmccain for giving what he knew was a fake steeledossier,negative
423,1257559999,LadySifResistsMake It Happen,Tue Aug 28 20:00:29 +0000 2018,Asgard & NH,theresistance arizona reacts to trumps reaction to johnmccainrip death,neutral
424,4895552534,Denise Wilkins,Tue Aug 28 20:00:29 +0000 2018,California USA,america is watching now we are holding all you honest politicians the shit thats,positive
425,4790597774,Cande Andrade,Tue Aug 28 20:00:31 +0000 2018,Vancouver-Mexico,hello usa from canada johnmccain was a whitesupremacist prolife genocidal warmonger please stop trying to bs the,neutral
426,1000555965165453313,Pam Larkin,Tue Aug 28 20:00:32 +0000 2018,California USA,the best way to honor legacy and apparently his final wish would be for his wife cindy to be name,positive
427,971155056430059520,Amazon Warrior,Tue Aug 28 20:00:32 +0000 2018,Everywhere ,very lovely tribute to by do you really want to honor your friend john denounce,positive
428,2324778534,Jacqui Byron,Tue Aug 28 20:00:33 +0000 2018,California USA,queen of the shit storms or divisionists,negative
429,31471559,Peter McConeghy,Tue Aug 28 20:00:34 +0000 2018,None,was viewed as a racist bigot by the press just a few short ye,negative
430,3001740905,Daniel Morgan GS,Tue Aug 28 20:00:35 +0000 2018,Washington DC,chair of intelligence program recollects his personal experience with senator john mccai,neutral
431,2904756511,Brian Jennings,Tue Aug 28 20:00:37 +0000 2018,None,im,irrelevant
432,571522524,Rob Sellers,Tue Aug 28 20:00:37 +0000 2018,Tulsa Oklahoma,the most important thing we can do my friends to improve education in america is to commit ourselves to the cause of s,positive
433,58652153,Lisette Root,Tue Aug 28 20:00:37 +0000 2018,Oregon State,this points out the inherent selfishness of this woman the words she said are despicable michael leave the gop,irrelevant
434,1533791462,StellaStar711,Tue Aug 28 20:00:38 +0000 2018,Boston,you are much kinder than i i beli,positive
435,2155923307,Andrea Valentini ,Tue Aug 28 20:00:38 +0000 2018,Toronto ON Canada ,if you really want to honor then stand up to as he did show a w,positive
436,934667124521521152,mikey,Tue Aug 28 20:00:38 +0000 2018,None,hillary stole the money for,irrelevant
437,23258386,Cherteapet,Tue Aug 28 20:00:38 +0000 2018,WI,to be as clear as possible no such conversation could ever have possibly happened youll keep,positive
438,885293166668034049,Marie smith,Tue Aug 28 20:00:39 +0000 2018,None,under pressure from american legion trump orders flag lowered at white house and other govt buildings until,negative
439,869954519593046016,Herasmus B. Jiggy,Tue Aug 28 20:00:39 +0000 2018,None,im old enough to remember when lindseygraham was considered to be johnmccains partner in resisting some of trumps exces,positive
440,925840192602226688,MsBabs,Tue Aug 28 20:00:40 +0000 2018,Fontana CA,cat 2008 johnmccain is mentally unfit to be president 2012 johnmccain is a racist and a woman hater,negative
441,1561539391,liberty lady ,Tue Aug 28 20:00:41 +0000 2018,None,what does it say about the dnc chairwoman when shes the hospital where seth rich was taken when murdered i suppose,positive
442,248405844,Deborah Alcorn,Tue Aug 28 20:00:43 +0000 2018,Hudson FL,when received the steele dossier and saw manafort putin and yanukovychs name in the same sentence he imme,neutral
443,570070771,Ruby McKay ,Tue Aug 28 20:00:44 +0000 2018,Asheville NC,mccain publicly asked that he not attend potus is respecting a dying mans last request its about mccain amp family no,neutral
444,3059092060,Tammy Jeffries,Tue Aug 28 20:00:44 +0000 2018,North Carolina USA,greer did you attend seth richs funeral or did you just send flowers and debate questions,irrelevant
445,14744838,Allan Ewart,Tue Aug 28 20:00:44 +0000 2018,Scotland United Kingdom,iraq bloomin typos twitter doesnt let,irrelevant
446,2495686176,Janice_TXBlessed,Tue Aug 28 20:00:44 +0000 2018,Deep in the heart of Texas,mccain publicly asked that he not attend potus is respecting a dying mans last request its about mccain amp family no,neutral
447,799332391416369152,Stella #we.are.the.change.we.seek,Tue Aug 28 20:00:44 +0000 2018,None,kelli ward really how utterly stupid do you have to be to believe that ended medical treatment to sp,negative
448,2342679650,Liquid Money Maker,Tue Aug 28 20:00:45 +0000 2018,None,well he is a sailor certainly cusses like one,positive
449,1024400893968572417,Senate Majority Liar,Tue Aug 28 20:00:45 +0000 2018,None,now you know i loved suggestion of naming a building after j,positive
450,285811870,Stacy B,Tue Aug 28 20:00:45 +0000 2018,None,very lovely tribute to by do you really want to honor your friend john denounce,positive
451,1017474651352518658,Lilia Kilmer,Tue Aug 28 20:00:46 +0000 2018,Earth,very lovely tribute to by do you really want to honor your friend john denounce,positive
452,942592907109736448, ,Tue Aug 28 20:00:47 +0000 2018,Auburn CA,just because trump finally decided to do the right thing dosent mean he wasnt disrespectful to first it dos,positive
453,359080538,Its me (with The Resistance),Tue Aug 28 20:00:47 +0000 2018,Los Angeles vicinity,protecting our democracy even after his death thank you rip steeledossier,irrelevant
454,924295350,William,Tue Aug 28 20:00:47 +0000 2018,Canada,the trail will be his demise,irrelevant
