,user_id,user_name,tweet_time,location,text,sentiment
455,793200858208931840,Just Mary,Tue Aug 28 20:00:48 +0000 2018,None,cry me a river of those crocodile tears your pretend sniffles and wavering voice while talking about,irrelevant
456,17091269,whatmaryate,Tue Aug 28 20:00:50 +0000 2018,None,if youve been banned from two funerals and a wedding make no mistake you are an asshole tuesdaythoughts barbar,irrelevant
457,3886302134,Doug Thomas,Tue Aug 28 20:00:49 +0000 2018,None,there is no bottom,irrelevant
458,1034529569951371265,leeanne liptak,Tue Aug 28 20:00:50 +0000 2018,None,bittersweet memories of powmia bracelets no soldier forgotten,irrelevant
459,979847091936747522,Granite State Resister,Tue Aug 28 20:00:51 +0000 2018,None,ah yes,irrelevant
460,111661883,Tami Hodge,Tue Aug 28 20:00:52 +0000 2018,Florida,mccain publicly asked that he not attend potus is respecting a dying mans last request its about mccain amp family no,neutral
461,33893374,DAG,Tue Aug 28 20:00:52 +0000 2018,None,trump truly is a vile pathetic vindictive little man tuesdaythoughts theresistance maga trump foxnews resist imp,negative
462,885182784,Margo Bond,Tue Aug 28 20:00:52 +0000 2018,Morrison CO,im old enough to remember when lindseygraham was considered to be johnmccains partner in resisting some of trumps exces,positive
463,269393785,@bjacobswein,Tue Aug 28 20:00:52 +0000 2018,Michigan USA,now waiting for graham to be that little bit of mccain he says he has in him,negative
464,1697531264,Georges Monfils Official,Tue Aug 28 20:00:52 +0000 2018,California USA,sincere question how can republican senators stand there and claim to honor johnmccain when theyve been gutless sellouts,positive
465,860832549337272321,Mary Jean Pompeo,Tue Aug 28 20:00:52 +0000 2018,None,your friend john mccain was the epitome of courage honor decency amp sincerity,neutral
466,1012319209018286080,Noelle Hanneken,Tue Aug 28 20:00:53 +0000 2018,Scranton PA,the farewell letter from to america,irrelevant
467,2340293795,Tammy DeGroot,Tue Aug 28 20:00:54 +0000 2018,None,johnmccain asked him not to attend remember if he attended youd be criticizing him for going against,neutral
468,1030512690077294594,,Tue Aug 28 20:00:54 +0000 2018,None,is a hero its a great loss our family offer you deepest condolences to his family,positive
469,273661134,SheResists,Tue Aug 28 20:00:54 +0000 2018,None,when received the steele dossier and saw manafort putin and yanukovychs name in the same sentence he imme,neutral
470,468097166,Noreen O'Grady,Tue Aug 28 20:00:55 +0000 2018,None,kelli ward really how utterly stupid do you have to be to believe that ended medical treatment to sp,negative
471,4885749963,Tequilaa Bob,Tue Aug 28 20:00:54 +0000 2018,Hiding on the East Coast,john came from an era when men were men and the rest of you had bone spurs,irrelevant
472,990596939572903937,taylor,Tue Aug 28 20:00:55 +0000 2018,None,i was five times stronger,irrelevant
473,965044995559477248,Gwen,Tue Aug 28 20:00:55 +0000 2018,None,i hope that many if not most or all will join because was a dear friend to all of us and a great american,positive
474,3347213853,Sup3rG1rl,Tue Aug 28 20:00:56 +0000 2018,United States,duluth navy veteran david wheatwho was held captive during the vietnam war w amp recalls using handsignal,positive
475,2795653799,Amanda Berg,Tue Aug 28 20:00:56 +0000 2018,Harrisburg PA,flags at halfstaff above the pennsylvania capitol to honor the passing of 82718,neutral
476,19342389,john murphy,Tue Aug 28 20:00:58 +0000 2018,TylerTexas,unseen it says our leader respects the final wishes of the deceased thats class obama would have ignored whatever the perso,neutral
477,76148455,Ryan,Tue Aug 28 20:00:58 +0000 2018,California USA,ive written to calling for the new headquarters to be named after few have given,negative
478,389198122,PMC,Tue Aug 28 20:00:58 +0000 2018,USA,im old enough to remember when lindseygraham was considered to be johnmccains partner in resisting some of trumps exces,positive
479,42520532,Adonia,Tue Aug 28 20:00:58 +0000 2018,Earth ,pssst mccain didnt and couldnt write anything he was in a coma for months,negative
480,627625719,Allie,Tue Aug 28 20:01:00 +0000 2018,None,phoenix love it godspeed sir and thank you,positive
481,587737444,Paul Grandsinger,Tue Aug 28 20:01:00 +0000 2018,California USA,why doesnt cnn just stop using santorum he,irrelevant
482,1032717747401048064,Democratic Socialist ,Tue Aug 28 20:01:01 +0000 2018,Portland Oregon An Extension  Of British Columbia Canada,trumps a pile of shit but mccain was a warhawk ne,negative
483,1113501800,Jen the Resister ,Tue Aug 28 20:01:02 +0000 2018,Southern CA,the negative narrative belongs only to for being a dumpster fire of a candidate,negative
484,1487364248,TimA,Tue Aug 28 20:01:02 +0000 2018,Tennessee you have to yell it!,very lovely tribute to by do you really want to honor your friend john denounce,positive
485,713615145,AKay,Tue Aug 28 20:01:03 +0000 2018,Washington DC,hey i just received a message from in heaven and he told me he stopped being your friend w,irrelevant
486,766003898935115776,Bernd Neuner,Tue Aug 28 20:01:03 +0000 2018,Spaceship Earth,no words can characterize johnmccain better than his own,positive
487,713781393684369408,American Dean  ,Tue Aug 28 20:01:05 +0000 2018,America ,what does it say about our system of government when people like you can help rig a primary and forward questions,positive
488,22267255,real_pr_pro,Tue Aug 28 20:01:05 +0000 2018,One vowel away from iconic,this is why i found tearful speech on the senate floor today while no doubt sincerely felt a,positive
489,3237290462,Lilianny Leebou,Tue Aug 28 20:01:07 +0000 2018,United States,maybe if you didnt abuse pills yourself,irrelevant
490,2842396104, Tom Pickett ,Tue Aug 28 20:01:07 +0000 2018,Old Fort NC,a is pretty harsh why dont you just call him what any cop would call him f junkie crackhead if it w,positive
491,28625375,BarbieQ  {}Red-Pilled.Com,Tue Aug 28 20:01:08 +0000 2018,California USA,mccain publicly asked that he not attend potus is respecting a dying mans last request its about mccain amp family no,neutral
492,23910844,Trace Vickrey,Tue Aug 28 20:01:09 +0000 2018,Arizona USA,holy crap says the media is using the president disrespecting to victimize,negative
493,24733117,Jeffrey Levin,Tue Aug 28 20:01:10 +0000 2018,San Jose CA,kelli ward really how utterly stupid do you have to be to believe that ended medical treatment to sp,negative
494,553740112,Bob Shaw,Tue Aug 28 20:01:10 +0000 2018,Texas USA,a special class of stupid,negative
495,774946020,Ahmxd,Tue Aug 28 20:01:11 +0000 2018,Cyprus,im sure they dont even know him either theyre just rolling with what the mainstream media is feeding them,positive
496,16261075,Seekandfind,Tue Aug 28 20:01:11 +0000 2018,New Jersey,president trump orders flags to halfstaff until next sunday in honor of sen mccain donaldtrump johnmccain,neutral
497,4230958101,Sarah Gould,Tue Aug 28 20:01:11 +0000 2018,None,kelli ward really how utterly stupid do you have to be to believe that ended medical treatment to sp,negative
498,1159047036,peace..,Tue Aug 28 20:01:12 +0000 2018,None,people who think everything is about themthink everything is about them,irrelevant
499,881254224,ErinGoBraugh,Tue Aug 28 20:01:13 +0000 2018,Texas,very lovely tribute to by do you really want to honor your friend john denounce,positive
500,809752566749941760,Lois Rossmann,Tue Aug 28 20:01:13 +0000 2018,None,im old enough to remember when lindseygraham was considered to be johnmccains partner in resisting some of trumps exces,positive
501,1028159336613380097,Tugeman Grierson,Tue Aug 28 20:01:13 +0000 2018,Alabama USA,it would say hes respecting mccains wisheshe told the world he didnt want trump at his funeral you dam democrats,neutral
502,3111721,klaatu barada nikto,Tue Aug 28 20:01:14 +0000 2018,Surfin' With The Alien,its a disgrace donna a real shame id never thought obama would not attend justice antonin scalias funeral,positive
503,7279532,Brenda C. Jinkins,Tue Aug 28 20:01:15 +0000 2018,Tennessee,you lie mccain requested trump not attend funeral sorta like when you lied about giving hillary the deba,neutral
504,755057200901398528,David ,Tue Aug 28 20:01:15 +0000 2018,Palm Springs CA,dear ur pain over the loss of ur dear friend johnmccain is clear and im truly sorry for ur loss now,negative
505,822936513679949825, peace ,Tue Aug 28 20:01:16 +0000 2018,None,very lovely tribute to by do you really want to honor your friend john denounce,positive
506,743405262,morkie,Tue Aug 28 20:01:16 +0000 2018,Indian Wells CA,i can only imagine how awkward you must have felt when obama snubbed nancy reagans funeral,negative
507,975526116449386497,jan resists,Tue Aug 28 20:01:17 +0000 2018,None,very lovely tribute to by do you really want to honor your friend john denounce,positive
508,799332391416369152,Stella #we.are.the.change.we.seek,Tue Aug 28 20:01:18 +0000 2018,None,the best way to honor legacy and apparently his final wish would be for his wife cindy to be name,positive
509,4005337393,#VoteThemOut #LivingWage #FuckTrump ,Tue Aug 28 20:01:19 +0000 2018,Wherever my assignment is,as spends the day googling himself amp not accepting that all the negative reports are reflection,negative
510,3774353714,Sharon,Tue Aug 28 20:01:21 +0000 2018,Anchorage AK,cat 2008 johnmccain is mentally unfit to be president 2012 johnmccain is a racist and a woman hater,negative
511,26523329,Maureen Sabo,Tue Aug 28 20:01:22 +0000 2018,Bethlehem PA,just because trump finally decided to do the right thing dosent mean he wasnt disrespectful to first it dos,positive
512,25376060,Marie Lena,Tue Aug 28 20:01:22 +0000 2018,Chicago,since johnmccain has left the hill the republican spines have gone with him former cia director,neutral
513,1059040274,Dr. John,Tue Aug 28 20:01:23 +0000 2018,North,i wasnt going to do this but the media and nevertrump fawning over senator mccain as a way to bash presid,neutral
514,16459846,Elizabeth Harper,Tue Aug 28 20:01:23 +0000 2018,Cornwall England,your occasional reminder has been in office 19 months and one week and has yet to visit our troops abro,neutral
515,18281269,Dawn Summers,Tue Aug 28 20:01:24 +0000 2018,T: 39.38671-74.414476,kelli ward really how utterly stupid do you have to be to believe that ended medical treatment to sp,negative
516,2851109528,Jim Briere,Tue Aug 28 20:01:24 +0000 2018,None,how about you let all 100s of thousands of voters you amp your sos purged off voter rolls why not do what your citi,irrelevant
517,23770072,renee rohr,Tue Aug 28 20:01:24 +0000 2018,None,kelli ward really how utterly stupid do you have to be to believe that ended medical treatment to sp,negative
518,2430576818,Daddys Girl,Tue Aug 28 20:01:25 +0000 2018,None,give it a rest did you gin up same drama when president obama failed to attend funeral of justice antonin,negative
519,764215513811517440,Trumpcardup,Tue Aug 28 20:01:25 +0000 2018,United States,unseen it says our leader respects the final wishes of the deceased thats class obama would have ignored whatever the perso,neutral
520,3237290462,Lilianny Leebou,Tue Aug 28 20:01:25 +0000 2018,United States,the fact that this dumbass tweet got 100 like,irrelevant
521,783207625324318720,Simply_RED,Tue Aug 28 20:01:26 +0000 2018,USA,cat sometimes we get it right sometimes we dont johnmccain got it wrong in death he could have brought pple together exten,negative
522,752214001,Brn2Wander,Tue Aug 28 20:01:26 +0000 2018,#PROUD AMERICA #MAGA Followed by the honorable @GenFlynn,i can only imagine how awkward you must have felt when obama snubbed nancy reagans funeral,negative
523,909422760,Ron Pyke,Tue Aug 28 20:01:27 +0000 2018,Indiana USA,under pressure from american legion trump orders flag lowered at white house and other govt buildings until,negative
524,165605880,Taftan,Tue Aug 28 20:01:27 +0000 2018,None,rajavip johnmccain god bless his soul,neutral
525,1552045110,DeF,Tue Aug 28 20:01:28 +0000 2018,South Carolina USA,what kind of hold does trump have on you people youve compromised you,positive
526,2743926708,Regina Peele,Tue Aug 28 20:01:28 +0000 2018,None,i hope that many if not most or all will join because was a dear friend to all of us and a great american,positive
527,792757777,FDR Forever,Tue Aug 28 20:01:30 +0000 2018,a music studio somewhere in NJ,kelli ward really how utterly stupid do you have to be to believe that ended medical treatment to sp,negative
528,819711551192055809,Rose ,Tue Aug 28 20:01:31 +0000 2018,Hogwarts,god bless johnmccain respect for this american citizen who proudly served our country for so many years rip,positive
529,820278616885985281,Kathy Carr,Tue Aug 28 20:01:31 +0000 2018,None,unseen it says our leader respects the final wishes of the deceased thats class obama would have ignored whatever the perso,neutral
530,4072378409,Nick Moore,Tue Aug 28 20:01:33 +0000 2018,None,the farewell letter from to america,irrelevant
531,1499032088,Betty Spence,Tue Aug 28 20:01:33 +0000 2018,Loganville GA,cry me a river of those crocodile tears your pretend sniffles and wavering voice while talking about,irrelevant
532,999055428125413376,LFerguson,Tue Aug 28 20:01:33 +0000 2018,None,very lovely tribute to by do you really want to honor your friend john denounce,positive
533,1022769497227362304,ryan karlson,Tue Aug 28 20:01:35 +0000 2018,Colorado USA,dm or call 1 7192869778 if you nee,irrelevant
534,1009475893125926912,Nita,Tue Aug 28 20:01:35 +0000 2018,South,needs to be removed from office this is a despicable take on his part theres no honor in the repub,irrelevant
535,68018314,ProLifePatriot #MAGA ,Tue Aug 28 20:01:36 +0000 2018,USA,cat 2008 johnmccain is mentally unfit to be president 2012 johnmccain is a racist and a woman hater,negative
536,449128263,Lezlie Hussein Obama,Tue Aug 28 20:01:36 +0000 2018,Denver Co,im old enough to remember when lindseygraham was considered to be johnmccains partner in resisting some of trumps exces,positive
537,924742185290907648,Renee Eskenazi,Tue Aug 28 20:01:37 +0000 2018,Seattle WA,kelli ward really how utterly stupid do you have to be to believe that ended medical treatment to sp,negative
538,4730403444,BonBon Resistance,Tue Aug 28 20:01:38 +0000 2018,Missouri USA,very lovely tribute to by do you really want to honor your friend john denounce,positive
539,845848194,eternal mountains,Tue Aug 28 20:01:39 +0000 2018,None,mcstain no hero or maverick he was a traitor to the end,irrelevant
540,722588211353100288,cinnaminnie,Tue Aug 28 20:01:39 +0000 2018,Rye NH,philly no geraldo thats not ok cindy mccain maybe qualified but with all due respect she just lost a husband and obviously,negative
541,2513357536,FTC 251 Zpol6,Tue Aug 28 20:01:39 +0000 2018,Kentucky USA,kelli ward really how utterly stupid do you have to be to believe that ended medical treatment to sp,negative
542,1120898341,Leanne,Tue Aug 28 20:01:40 +0000 2018,California USA,the best way to honor legacy and apparently his final wish would be for his wife cindy to be name,positive
543,4694807839,Antje ,Tue Aug 28 20:01:40 +0000 2018,Berlin Germany,very lovely tribute to by do you really want to honor your friend john denounce,positive
544,2233217629,Kevin Paul,Tue Aug 28 20:01:41 +0000 2018,Utopia,kelli ward really how utterly stupid do you have to be to believe that ended medical treatment to sp,negative
545,3105174701,Karen Hamilton ,Tue Aug 28 20:01:42 +0000 2018,Georgia USA,s the reverse is actually the case for the first time in american history we have a sitting us senator issue a dying wish to,positive
546,93681504,Matt D ,Tue Aug 28 20:01:43 +0000 2018,A shithole country,uscis crying on the floor of the senate remembering it is the equivalent of faking a political o,negative
547,382209139,Pam Forrest,Tue Aug 28 20:01:43 +0000 2018,None,you lie mccain requested trump not attend funeral sorta like when you lied about giving hillary the deba,neutral
548,957174500105302016,Adam Stark,Tue Aug 28 20:01:44 +0000 2018,Jupiter,kelli ward really how utterly stupid do you have to be to believe that ended medical treatment to sp,negative
549,707038576970637313,Marylou lozano ,Tue Aug 28 20:01:44 +0000 2018,New Mexico USA,i wasnt going to do this but the media and nevertrump fawning over senator mccain as a way to bash presid,neutral
550,734624229648412672,aminul,Tue Aug 28 20:01:44 +0000 2018,None,i will do amazing logo or image to vector trace vectorize tracing asap contact me,positive
551,512625174,barbara zarrella,Tue Aug 28 20:01:44 +0000 2018,PSL. FL,my tribute to no ordinary warrior,positive
552,2696325938,Mammy,Tue Aug 28 20:01:44 +0000 2018,None,wouldnt want this pinhead bimbo to treat my illness classless foolish just plain stupid arrogant ignorant and,negative
553,1031226045486301186,georgianne schriefer,Tue Aug 28 20:01:45 +0000 2018,None,bittersweet memories of powmia bracelets no soldier forgotten,irrelevant
554,759703429, Christie (70 days to midterms) Manussier ,Tue Aug 28 20:01:46 +0000 2018,Wisconsin,nothing will erase your fawning over for last months on earthnot one peep out of u whi,neutral
555,894300975669796864,Chet A Blum,Tue Aug 28 20:01:47 +0000 2018,Clovis CA,i hope that many if not most or all will join because was a dear friend to all of us and a great american,positive
556,862394271692840960,Mary Woodlee,Tue Aug 28 20:01:47 +0000 2018,Aurora CO,russia has come out with hateful rhetoric about lets show russia putin and viads puppet,irrelevant
557,82381023,Deplorable2327 ,Tue Aug 28 20:01:47 +0000 2018,None,is this a gentlemans way of speaking to women is this the way our senators speak to others especially to women,neutral
558,908159499835338752,Nester1957,Tue Aug 28 20:01:48 +0000 2018,Proudly  Canadian ,sincere question how can republican senators stand there and claim to honor johnmccain when theyve been gutless sellouts,positive
559,818272736757747712,Dawnne Patterson,Tue Aug 28 20:01:49 +0000 2018,None,this might be ur one saving grace he was ur friend please take a lesson in honor,irrelevant
560,1864823586,John Tidwell,Tue Aug 28 20:01:50 +0000 2018,Louisiana USA,cat sometimes we get it right sometimes we dont johnmccain got it wrong in death he could have brought pple together exten,negative
561,819068622932877312,Carolyn  Gray Kraft,Tue Aug 28 20:01:52 +0000 2018,Batavia Illinois ,traitor,irrelevant
562,1209364268,Mark Trued,Tue Aug 28 20:01:53 +0000 2018,Kansas City MO,if youve been banned from two funerals and a wedding make no mistake you are an asshole tuesdaythoughts barbar,irrelevant
563,3105174701,Karen Hamilton ,Tue Aug 28 20:01:54 +0000 2018,Georgia USA,cat our devoted djt was excluded from johnmccains funeral to fuel disgusting hatred and,negative
564,360931419,Kate Landis,Tue Aug 28 20:01:55 +0000 2018,Pennsylvania,flags at halfstaff above the pennsylvania capitol to honor the passing of 82718,neutral
565,1900832562,The Vanilla Godzilla8,Tue Aug 28 20:01:56 +0000 2018,Hollywood Phoenix Tokyo,presidentcarters opinion of the potus amp being disrespectful of johnmccain all because of a grudge he should be,neutral
566,86969345,Maria Garcia,Tue Aug 28 20:01:58 +0000 2018,Wichita Ks,very lovely tribute to by do you really want to honor your friend john denounce,positive
567,53512289,Meredith Piatt,Tue Aug 28 20:01:59 +0000 2018,North Carolina,very lovely tribute to by do you really want to honor your friend john denounce,positive
568,552895143,Deborah_ K,Tue Aug 28 20:01:59 +0000 2018,Illinois USA,i can only imagine how awkward you must have felt when obama snubbed nancy reagans funeral,negative
569,1056103368,Brian Elder,Tue Aug 28 20:01:59 +0000 2018,New Jersey USA,under pressure from american legion trump orders flag lowered at white house and other govt buildings until,negative
570,892212233303977985,grumpy independent,Tue Aug 28 20:02:00 +0000 2018,None,kelli ward really how utterly stupid do you have to be to believe that ended medical treatment to sp,negative
571,851942613850750976,Nancy,Tue Aug 28 20:02:00 +0000 2018,None,thank you for your kind and honest words about our hero where wer,positive
572,1021414521607467013,john wayne,Tue Aug 28 20:02:01 +0000 2018,United States,ur memes suk make you look like a snowflake,irrelevant
573,25941400,,Tue Aug 28 20:02:01 +0000 2018,Chicago IL,posthumous happens,irrelevant
574,827250476034895872,Armando Rosales,Tue Aug 28 20:02:02 +0000 2018,Los BanosCA.,very lovely tribute to by do you really want to honor your friend john denounce,positive
575,31054493,Suneet Mahandru,Tue Aug 28 20:02:02 +0000 2018,New York,historic note 10 years ago today in denver accepted the democratic presidential nomination he said we,irrelevant
576,220428765,Marty Peterson,Tue Aug 28 20:02:01 +0000 2018,USA,chevalier u mad bro,negative
577,995380302049505280,Sajana/cece,Tue Aug 28 20:02:03 +0000 2018,Hawaii USA,remember when johnmccain wanted to take water from the navajo nation a nation where 40 of our population didnt have a,neutral
578,922263870,Lynne Fox,Tue Aug 28 20:02:03 +0000 2018,None,kelli ward really how utterly stupid do you have to be to believe that ended medical treatment to sp,negative
579,172496995,Chad,Tue Aug 28 20:02:04 +0000 2018,Binkley's Closet Bloom County,holy crap says the media is using the president disrespecting to victimize,negative
580,3836645961,Terese Zimmerman,Tue Aug 28 20:02:05 +0000 2018,None,cindy mccain should immediately replace her husband until the end of his term as john mccain wished,neutral
581,1034522735450484736,marcie fukunaga,Tue Aug 28 20:02:02 +0000 2018,None,bittersweet memories of powmia bracelets no soldier forgotten,irrelevant
582,2738632115,Kim T,Tue Aug 28 20:02:05 +0000 2018,None,uscis lindsey shame on you you have failed to live up to sen mccains expectations fo,negative
583,831651493329580032,Marty,Tue Aug 28 20:02:06 +0000 2018,California USA,ditto ditto ditto did he not carry the fake dossier and hand it to someone acting like it was the real deal knowing it,negative
584,291774022,JoeInWV ,Tue Aug 28 20:02:07 +0000 2018,West Virginia,friends like who needs enemies,irrelevant
585,865651857963614208,Lizanne Bello,Tue Aug 28 20:02:07 +0000 2018,None,a war hero a statesman only gets one day this president should order the flags to be flown at h,neutral
586,74283390,Anne Arjani,Tue Aug 28 20:02:07 +0000 2018,The Bay Area California,why bother you betray him by encouraging trump to dump sessions,irrelevant
587,827118561600663552,LovinLifeGwen,Tue Aug 28 20:02:07 +0000 2018,Florida USA,cat 2008 johnmccain is mentally unfit to be president 2012 johnmccain is a racist and a woman hater,negative
588,40083800,Paul Z.,Tue Aug 28 20:02:08 +0000 2018,None,kelli ward really how utterly stupid do you have to be to believe that ended medical treatment to sp,negative
589,16280127,hhelenhh,Tue Aug 28 20:02:08 +0000 2018,Louisville CO,kelli ward really how utterly stupid do you have to be to believe that ended medical treatment to sp,negative
590,1003873108346966016,PapaFrank,Tue Aug 28 20:02:09 +0000 2018,United States,im old enough to remember when lindseygraham was considered to be johnmccains partner in resisting some of trumps exces,positive
591,1011974082,Graham,Tue Aug 28 20:02:09 +0000 2018,NY/CA,sincere question how can republican senators stand there and claim to honor johnmccain when theyve been gutless sellouts,positive
592,833051401039314945,SANDY #SaveTimeless #Timeless #Supernatural,Tue Aug 28 20:02:09 +0000 2018,Midwest USA,when received the steele dossier and saw manafort putin and yanukovychs name in the same sentence he imme,neutral
593,1828562480,amzieaa,Tue Aug 28 20:02:09 +0000 2018,None,next person who tweets some sweet graha,positive
594,705480398537670656,AuntieVodkaFlorist Gump,Tue Aug 28 20:02:10 +0000 2018,New York NY,unseen it says our leader respects the final wishes of the deceased thats class obama would have ignored whatever the perso,neutral
595,1704490550,I see you,Tue Aug 28 20:02:10 +0000 2018, USA,you know in his last weeks he must of been appalled of the person his former frien,negative
596,938897659276021760,HowTooMAGer  ,Tue Aug 28 20:02:10 +0000 2018,Florida USA,very lovely tribute to by do you really want to honor your friend john denounce,positive
597,3057728463,Elaine too,Tue Aug 28 20:02:12 +0000 2018,Knoxville TN,cat sometimes we get it right sometimes we dont johnmccain got it wrong in death he could have brought pple together exten,negative
598,82381023,Deplorable2327 ,Tue Aug 28 20:02:12 +0000 2018,None,i wasnt going to do this but the media and nevertrump fawning over senator mccain as a way to bash presid,neutral
599,967175216378990592,MyHammy218,Tue Aug 28 20:02:13 +0000 2018,AMERICA,cat what does it say about your american icon who asked that our not attend his funeral,irrelevant
600,232879394,Teresa,Tue Aug 28 20:02:14 +0000 2018,California USA,i can only imagine how awkward you must have felt when obama snubbed nancy reagans funeral,negative
601,3328731816,JB Petten,Tue Aug 28 20:02:16 +0000 2018,San Francisco,ive written to calling for the new headquarters to be named after few have given,negative
602,196871565,~~~mnie ,Tue Aug 28 20:02:16 +0000 2018,KAG*2020,please replace johnmccain with a republican patriotic american not cindymccain or meghanmccain,neutral
603,34279982,Critical Mass,Tue Aug 28 20:02:17 +0000 2018,Colorado USA,only the trump administration itself has had more ups and downs than the white house flag mccain,positive
604,958907147970076673,Denese Kesling,Tue Aug 28 20:02:17 +0000 2018,None,take your own advice,positive
605,468783338,Rhonda Crane#MAGA,Tue Aug 28 20:02:19 +0000 2018,Washington USA,i can only imagine how awkward you must have felt when obama snubbed nancy reagans funeral,negative
606,386598890,B R Mom,Tue Aug 28 20:02:20 +0000 2018,None,uscis crying on the floor of the senate remembering it is the equivalent of faking a political o,negative
