,user_id,user_name,tweet_time,location,text,sentiment
658,1915476836,MadMD ,Tue Aug 28 20:02:48 +0000 2018,Helotes TX,peterdaou im old enough to remember when lindseygraham was considered to be johnmccains partner in resisting some of trumps exces,positive
659,2543099457,stephanie kulesa,Tue Aug 28 20:02:50 +0000 2018,None,lindseygrahamsc seanhannity senjohnmccain i cried watching you this morning praise mccain now you go on hannity,neutral
660,937714915934052352,pipdawg1991,Tue Aug 28 20:02:51 +0000 2018,None,senategop senators remember american hero senjohnmccain he will be missed,neutral
661,719986812547153920,James,Tue Aug 28 20:02:51 +0000 2018,South Haven MI,jalicat johnpavlovitz our devoted potus djt was excluded from johnmccains cindymccain funeral to fuel dnc disgusting hatred and,negative
662,823351367443980289,Karen Weber,Tue Aug 28 20:02:51 +0000 2018,None,blueghost40 if youve been banned from two funerals and a wedding make no mistake you are an asshole tuesdaythoughts barbar,irrelevant
663,22501421,Nadine,Tue Aug 28 20:02:52 +0000 2018,None,caitoz this is a special kind of nauseating,positive
664,886012852393226240,Jaiyaa,Tue Aug 28 20:02:53 +0000 2018,United States,colmorrisdavis holy crap ricksantorum says the media is using the president disrespecting senjohnmccain to victimize realdonaldtr,negative
665,744179780,Bev Baird,Tue Aug 28 20:02:55 +0000 2018,Proud Canadian ,peterdaou im old enough to remember when lindseygraham was considered to be johnmccains partner in resisting some of trumps exces,positive
666,2324778534,Jacqui Byron,Tue Aug 28 20:02:56 +0000 2018,California USA,dretiquette i can only imagine how awkward you must have felt when obama snubbed nancy reagans funeral,negative
667,1397485152,Dave Parker,Tue Aug 28 20:02:56 +0000 2018,Pocatello Idaho,blueghost40 if youve been banned from two funerals and a wedding make no mistake you are an asshole tuesdaythoughts barbar,irrelevant
668,777930679849934848,Tony Camatto,Tue Aug 28 20:02:56 +0000 2018,NYC,thinbluelr mccain told him not to you moron why dont you tell us what happened to sethrich you wildebeest,negative
669,709600530285211648,TapperFactChucksMyMercatusM4A&SharkOpsFish,Tue Aug 28 20:02:57 +0000 2018,None,johnmccain you were a sweetheart of bombs,neutral
670,1012329853,Liz Blaha  #DemForce  #TheResistance,Tue Aug 28 20:02:57 +0000 2018,Buffalo Valley  Tennessee,bspence5 msnbc never heard anything that rings so untrue as lindseygrahamsc talking what johnmccain taught himhe learned nothing h,neutral
671,1034529589224255488,nancey crook,Tue Aug 28 20:02:58 +0000 2018,None,judyschear bittersweet memories of powmia bracelets no soldier forgotten,irrelevant
672,702201788250738693,anAmericanDissenter,Tue Aug 28 20:02:58 +0000 2018,United States,votevets donald trump refuses to lower flag for john mccain as we said yesterday donald trump is a pathetic thinskinned selfce,negative
673,724375793825026048,DeeBeeTeedOff,Tue Aug 28 20:02:58 +0000 2018,United States,can you victimize the ultimate victimizer,neutral
674,1909758854,kiran  ,Tue Aug 28 20:02:58 +0000 2018,bi brown feminist M-L. She/Her,more recently johnmccain voted to block a deal to end american involvement in the increasingly genocidal saudil,positive
675,39648644,my62bug,Tue Aug 28 20:02:59 +0000 2018,Nowhere Man,dretiquette i can only imagine how awkward you must have felt when obama snubbed nancy reagans funeral,negative
676,398985246,Suzi S A,Tue Aug 28 20:02:59 +0000 2018,None,patrici15767099 did you forget that on his death bed john mccain said he didnt want the leader of the free world to attend his funer,positive
677,720047327168303104,Lou Johnson,Tue Aug 28 20:03:00 +0000 2018,None,wvjoe911 cry me a river lindseygrahamsc of those crocodile tears your pretend sniffles and wavering voice while talking about senj,irrelevant
678,14526644,Chris Pugh,Tue Aug 28 20:03:00 +0000 2018,Columbus OH,johnkasich senjohnmccain reminds us that wherever you live whatever you do that you can make a difference in the way the world tu,positive
679,1697531264,Georges Monfils Official,Tue Aug 28 20:03:00 +0000 2018,California USA,elizacollins1 the farewell letter from senjohnmccain to america,neutral
680,817488870686101504,Sandy Alano,Tue Aug 28 20:03:01 +0000 2018,None,rodrigothemexi lindseygrahamsc senjohnmccains ill tell you what we didnt miss was you turning your back on the ideals that senjo,negative
681,14105632,JD Resists,Tue Aug 28 20:03:01 +0000 2018,Fort Lauderdale,michaelsteele kelli ward really how utterly stupid do you have to be to believe that senjohnmccain ended medical treatment to sp,negative
682,909448472503480320,that girl heather,Tue Aug 28 20:03:02 +0000 2018,Florida,altuscis lindseygrahamsc crying on the floor of the senate remembering senjohnmccain it is the equivalent of faking a political o,negative
683,74283390,Anne Arjani,Tue Aug 28 20:03:02 +0000 2018,The Bay Area California,lindseygrahamsc senjohnmccain do you need a russian tutor,neutral
684,1340511360,David Hamelin,Tue Aug 28 20:03:02 +0000 2018,None,lovingcapecod jiminhofe senjohnmccain really mccain was part of the problem with the flag the president is a 2 bit ass,positive
685,587737444,Paul Grandsinger,Tue Aug 28 20:03:02 +0000 2018,California USA,colmorrisdavis ricksantorum senjohnmccain realdonaldtrump cnn chriscuomo the next time i see rick santorum on,neutral
686,16051220,cattiekit,Tue Aug 28 20:03:02 +0000 2018,None,blueghost40 if youve been banned from two funerals and a wedding make no mistake you are an asshole tuesdaythoughts barbar,irrelevant
687,803058408,Dyslexic doG,Tue Aug 28 20:03:04 +0000 2018,None,peterdaou im old enough to remember when lindseygraham was considered to be johnmccains partner in resisting some of trumps exces,positive
688,700012184689049600,Eva Durn,Tue Aug 28 20:03:04 +0000 2018,None,maryamrajavi my most profound condolences to the mccain family on the passing of senjohnmccain he will always be remembered for his,positive
689,874426822263316480,Bruce Benigno,Tue Aug 28 20:03:06 +0000 2018,USA,jalicat sometimes we get it right sometimes we dont johnmccain got it wrong in death he could have brought pple together exten,negative
690,2294568643,Sealord,Tue Aug 28 20:03:09 +0000 2018,Left Coast,just make sure lindsay graham is not recruited,positive
691,770280543804133376,DarkForce,Tue Aug 28 20:03:07 +0000 2018,United States,geoffrbennett this is incredible,positive
692,841743634328367108,Trust is a powerful thing.,Tue Aug 28 20:03:10 +0000 2018,242yrs(+) of greatness ,senategop senators remember american hero senjohnmccain he will be missed,neutral
693,16009000,Steve Pollastrini,Tue Aug 28 20:03:10 +0000 2018,California,michaelsteele kelli ward really how utterly stupid do you have to be to believe that senjohnmccain ended medical treatment to sp,negative
694,2848211729,Richard Soto,Tue Aug 28 20:03:10 +0000 2018,Tacoma WA,wvjoe911 cry me a river lindseygrahamsc of those crocodile tears your pretend sniffles and wavering voice while talking about senj,irrelevant
695,700012184689049600,Eva Durn,Tue Aug 28 20:03:11 +0000 2018,None,4freedominiran2 maryamrajavi senjohnmccain cindymccain a man passed away who was determined to fight against the conspiracies of t,neutral
696,4913913182,Lori Anderson,Tue Aug 28 20:03:12 +0000 2018,Podunk USA,blueghost40 if youve been banned from two funerals and a wedding make no mistake you are an asshole tuesdaythoughts barbar,irrelevant
697,770280543804133376,DarkForce,Tue Aug 28 20:03:07 +0000 2018,United States,geoffrbennett this is incredible,positive
698,917151607195881474,Matthew Wright,Tue Aug 28 20:03:12 +0000 2018,South Dakota USA,jiminhofe senjohnmccain we miss john mccain so much because he would have never said something like you did about,positive
699,2324778534,Jacqui Byron,Tue Aug 28 20:03:13 +0000 2018,California USA,dutyofapatriot mccain publicly asked that he not attend potus is respecting a dying mans last request its about mccain amp family no,neutral
700,735542572332941312,DebbCheyne,Tue Aug 28 20:03:13 +0000 2018,None,tomtugendhat ive written to jensstoltenberg calling for the new nato headquarters to be named after senjohnmccain few have given,negative
701,71077281,Balanced Dogs,Tue Aug 28 20:03:13 +0000 2018,Coastal Zone,kelly2277 when senjohnmccain received the steele dossier and saw manafort putin and yanukovychs name in the same sentence he imme,neutral
702,74283390,Anne Arjani,Tue Aug 28 20:03:14 +0000 2018,The Bay Area California,dcrunner lindseygrahamsc senjohnmccain pay tribute with your actions not your words senator your fullon embrace of donald trump i,neutral
703,1029917496382390272,Domino Roe,Tue Aug 28 20:03:15 +0000 2018,Oregon USA,joncoopertweets the best way to honor senjohnmccains legacy and apparently his final wish would be for his wife cindy to be name,positive
704,707038576970637313,Marylou lozano ,Tue Aug 28 20:03:16 +0000 2018,New Mexico USA,doberdad62 the real john mccain maybe we can actually get a republican in that seat now,positive
705,987442836558761984,Andrenoah,Tue Aug 28 20:03:16 +0000 2018,Gonzales LA,michaelsteele kelli ward really how utterly stupid do you have to be to believe that senjohnmccain ended medical treatment to sp,negative
706,987772606836244481,SecretSquirrel 275,Tue Aug 28 20:03:17 +0000 2018,NOYFB USA,dretiquette i can only imagine how awkward you must have felt when obama snubbed nancy reagans funeral,negative
707,700012184689049600,Eva Durn,Tue Aug 28 20:03:19 +0000 2018,None,mohsenmehr93 maryamrajavi senjohnmccain cindymccain senator john mccain has always been a close friend to the people and resistanc,neutral
708,208097122,patriciaridenour,Tue Aug 28 20:03:19 +0000 2018,None,justkim176 londonsgirl patmathewsriden senjohnmccain what a fabulous piece of history,positive
709,249832494,Richard Mills,Tue Aug 28 20:03:21 +0000 2018,None,cb618444 what does it say trump is a great judge or character or lack thereof its beyond how drats love songbirdits bec,positive
710,715309583,Joseph Stotz,Tue Aug 28 20:03:22 +0000 2018,Springfield VA,mayoclinic senjohnmccain he deserved better yes harvard,positive
711,865278964104691713,keith schulz,Tue Aug 28 20:03:24 +0000 2018,None,michaelsteele careerfed senjohnmccain is michael steele still in gop would think he would switch over to dems,neutral
712,94036964,Evangelic Potpourri,Tue Aug 28 20:03:24 +0000 2018,Sidney MT,unfortunately i didnt get the question before you tweeted this so i am not prepared to answer it just yet,negative
713,28936498,Susan,Tue Aug 28 20:03:24 +0000 2018,USA,peterdaou im old enough to remember when lindseygraham was considered to be johnmccains partner in resisting some of trumps exces,positive
714,700012184689049600,Eva Durn,Tue Aug 28 20:03:25 +0000 2018,None,poyaranjbar maryamrajavi senjohnmccain cindymccain the soul is happy in gods favor this great man the iranian peoples resistance,positive
715,763844670422126592,Trump da man,Tue Aug 28 20:03:25 +0000 2018,Coralville IA,dretiquette i can only imagine how awkward you must have felt when obama snubbed nancy reagans funeral,negative
716,916649322745298944,Carrie Kremer,Tue Aug 28 20:03:25 +0000 2018,None,senategop senators remember american hero senjohnmccain he will be missed,neutral
717,69879584,Dianna Colasurdo,Tue Aug 28 20:03:27 +0000 2018,Washington DC,senategop senators remember american hero senjohnmccain he will be missed,neutral
718,375927450,j scurry,Tue Aug 28 20:03:28 +0000 2018,TX,michaelsteele rolandsmartin senjohnmccain her mouth might have created a great campaign ad for her opponents ta,positive
719,755057200901398528,David ,Tue Aug 28 20:03:29 +0000 2018,Palm Springs CA,dearauntcrabby very lovely tribute to senjohnmccain by lindseygrahamsc do you really want to honor your friend john denounce re,positive
720,2312902755,Dan Herrin ,Tue Aug 28 20:03:30 +0000 2018,Birmingham AL,what does it say when the chair of a large political party dnc cheats and gets the questions beforehand to a nati,positive
721,262292578,Arrowyn Green,Tue Aug 28 20:03:30 +0000 2018,Maryland USA,dearauntcrabby very lovely tribute to senjohnmccain by lindseygrahamsc do you really want to honor your friend john denounce re,positive
722,427679559,iokea 17,Tue Aug 28 20:03:30 +0000 2018,Ola'a Hawai'i,michaelsteele kelli ward really how utterly stupid do you have to be to believe that senjohnmccain ended medical treatment to sp,negative
723,902217192795754497,Eli Roman/#VetsResistSquadron,Tue Aug 28 20:03:31 +0000 2018,Puerto Rico (NYC Native),blueghost40 if youve been banned from two funerals and a wedding make no mistake you are an asshole tuesdaythoughts barbar,irrelevant
724,624724083,Marie Goforth,Tue Aug 28 20:03:32 +0000 2018,San Antonio TX,mitchellreports under pressure from american legion trump orders flag lowered at white house and other govt buildings until senjohnmc,negative
725,4893086944,Rhonda D Willoughy,Tue Aug 28 20:03:32 +0000 2018,None,dearauntcrabby very lovely tribute to senjohnmccain by lindseygrahamsc do you really want to honor your friend john denounce re,positive
726,7824452,Tom Mercado,Tue Aug 28 20:03:33 +0000 2018,Phx. AZ.,tomtugendhat ive written to jensstoltenberg calling for the new nato headquarters to be named after senjohnmccain few have given,negative
727,784959256990670849,Jane,Tue Aug 28 20:03:33 +0000 2018,None,peterdaou sincere question how can republican senators stand there and claim to honor johnmccain when theyve been gutless sellouts,positive
728,2208329164,Madmouth University,Tue Aug 28 20:03:34 +0000 2018,None,tsimsparker dougducey senjohnmccain mccain lied to us about ocare he was spiteful and vengeful til his last breath with trump he,neutral
729,903032537345384449,KwankwasO,Tue Aug 28 20:03:35 +0000 2018,None,ilmseeker this is the guy all these madkhalis refer back to when discussing saudis foreign affairs hes praising an enemy of the mu,negative
730,164029981,Aloysius ^. .^,Tue Aug 28 20:03:35 +0000 2018,*..*,isaackappy what does it say about donnabrazile that she apparently showed up at the hospital right after sethrich was shot,positive
731,44537636,jack jordan,Tue Aug 28 20:03:35 +0000 2018,LA California,senduckworth beautiful moving words from late senjohnmccain do not despair of our present difficulties we believe always in the p,positive
732,719883243533836288,Lois Kaness.,Tue Aug 28 20:03:36 +0000 2018,None,ganczha realdonaldtrump wasnt it you who said sons of bitches who disrespect veterans should be fired youre fired alternativ,irrelevant
733,2282617496,MarchingNonny,Tue Aug 28 20:03:37 +0000 2018,None,michaelsteele kelli ward really how utterly stupid do you have to be to believe that senjohnmccain ended medical treatment to sp,negative
734,971459656039190528,Colleen B,Tue Aug 28 20:03:36 +0000 2018,WI. USA,senronjohnson senjohnmccain shut up ron johnson john mccain did not like you he didnt like the fact that you s,neutral
735,1007879270549426176,Chris Basis,Tue Aug 28 20:03:38 +0000 2018,Washington USA,dougducey senjohnmccain is courage beating up on dolores alfond of national alliance of family members powmia a,neutral
736,936685568242737153,kathy furz,Tue Aug 28 20:03:38 +0000 2018,None,jonfavs jwgop john thx4rt amp jon 4 update saw that on cspan mitch is just like djtpos amp lindsey too sells o,irrelevant
737,1029396254,kik_nyc,Tue Aug 28 20:03:38 +0000 2018,New York NY,kelly2277 when senjohnmccain received the steele dossier and saw manafort putin and yanukovychs name in the same sentence he imme,neutral
738,3736006760,Jonathan Clary,Tue Aug 28 20:03:39 +0000 2018,Rototuna Hamilton City,peterdaou im old enough to remember when lindseygraham was considered to be johnmccains partner in resisting some of trumps exces,positive
739,199056069, (Mossadjongen),Tue Aug 28 20:03:39 +0000 2018,The East.,stupid is as stupid does and yes these people are objectively stupid probably mentally ill,negative
740,2964699813,Erle Nielsen,Tue Aug 28 20:03:40 +0000 2018,None,michaelsteele kelli ward really how utterly stupid do you have to be to believe that senjohnmccain ended medical treatment to sp,negative
741,536399368,AndyMike,Tue Aug 28 20:03:41 +0000 2018,Oregon,meghanmccain i love you forever my beloved father senjohnmccain,positive
742,147993301,Aunie,Tue Aug 28 20:03:41 +0000 2018,None,jalicat sometimes we get it right sometimes we dont johnmccain got it wrong in death he could have brought pple together exten,negative
743,3267687013,@LetFREEDOMring,Tue Aug 28 20:03:42 +0000 2018,United States,dtinchitown rip shipmate so realdonaldtrump says nfl players who kneel dont respect our military or flag but it took backlash for,negative
744,633343531,KarHen,Tue Aug 28 20:03:43 +0000 2018,Tucson AZ,mermtm mitchellreports lindseygrahamsc senjohnmccain aahhhgotchayeah we do need a sarcasm font although,neutral
745,34072187,Tammy O'Neill,Tue Aug 28 20:03:44 +0000 2018,California,kelly2277 when senjohnmccain received the steele dossier and saw manafort putin and yanukovychs name in the same sentence he imme,neutral
746,1927936586,Shannon Campbell,Tue Aug 28 20:03:44 +0000 2018,Montgomery TX,lisaoleary524 has a point the odds are not good glioblastoma is the worst of the worst it needs more,negative
747,719883243533836288,Lois Kaness.,Tue Aug 28 20:03:44 +0000 2018,None,peterdaou sincere question how can republican senators stand there and claim to honor johnmccain when theyve been gutless sellouts,positive
748,22012737,mo,Tue Aug 28 20:03:46 +0000 2018,Seattle WA,lindseygrahamsc senjohnmccain traitor you forsake him for trump politics,neutral
749,862785638000599040,Chicago Mike 2.0 ,Tue Aug 28 20:03:46 +0000 2018,San Diego CA,lindseygrahamsc is a piece of crap democrats have shown more class amp respect for senjohnmccain than his own frie,positive
750,951803025961742337,Steve Smith,Tue Aug 28 20:03:46 +0000 2018,Pennsylvania USA,michaelsteele kelli ward really how utterly stupid do you have to be to believe that senjohnmccain ended medical treatment to sp,negative
751,1913305777,kool,Tue Aug 28 20:03:47 +0000 2018,La Habra CA,senatemajldr senjohnmccain funding for election security,neutral
752,3746491,Michelle L. Quinn,Tue Aug 28 20:03:47 +0000 2018,#nwindiana,dpetagrew altuscis lindseygrahamsc senjohnmccain and the info the russians have on him,neutral
753,2295416540,Julie,Tue Aug 28 20:03:48 +0000 2018,Somewhere over the rainbow,which is what makes his tearful speech on the senate floor so damn disingenuous,irrelevant
754,978702724014501888,Jeanie rhyne,Tue Aug 28 20:03:48 +0000 2018,None,blueghost40 if youve been banned from two funerals and a wedding make no mistake you are an asshole tuesdaythoughts barbar,irrelevant
755,863933592,My Country Is Broken,Tue Aug 28 20:03:48 +0000 2018,None,dearauntcrabby very lovely tribute to senjohnmccain by lindseygrahamsc do you really want to honor your friend john denounce re,positive
756,202359470,Richard Johnston,Tue Aug 28 20:03:48 +0000 2018,Edinburgh,johnamaechi classless,irrelevant
757,1021426780647780353,DENNIS HESS,Tue Aug 28 20:03:49 +0000 2018,AZ,senategop senjohnmccain hero my a turncoat,neutral
758,42924745,togetherforever,Tue Aug 28 20:03:50 +0000 2018,None,dearauntcrabby very lovely tribute to senjohnmccain by lindseygrahamsc do you really want to honor your friend john denounce re,positive
759,825166422707933185,Dragonfly63,Tue Aug 28 20:03:50 +0000 2018,Florida,yashar the way senator mccain has been treated in the twilight of his life particularly by members of his own party has been heartbr,positive
760,2838118256,Boycott Dr. Phil,Tue Aug 28 20:03:51 +0000 2018,None,michaelsteele kelli ward really how utterly stupid do you have to be to believe that senjohnmccain ended medical treatment to sp,negative
761,724545506,Kim Dz......,Tue Aug 28 20:03:51 +0000 2018,Native Detroiter,colmorrisdavis holy crap ricksantorum says the media is using the president disrespecting senjohnmccain to victimize realdonaldtr,negative
762,2254482530,Alexandra de LaPorta,Tue Aug 28 20:03:52 +0000 2018,Southern California ,carlossimancas what does it say about the chair of the democratic national committee leaking questions to crooked hillary before a tow,neutral
763,1032983455297101824,Sharon Lovell,Tue Aug 28 20:03:52 +0000 2018,Sweet Home Alabama,sbpwidow senjohnmccain senjackreed jiminhofe mactxpress repadamsmith you blocked the amendment to end the unfair offset on milita,negative
764,274522759,William R. Staplin,Tue Aug 28 20:03:52 +0000 2018,Des Moines Iowa,dannowicki president trump has signed into law the john s mccain national defense authorization act senate armed services chairman,neutral
765,65609788,JK Schrader,Tue Aug 28 20:03:52 +0000 2018,Germany,robertkennedyjr great piece johnmccainrip,positive
766,706563205,Maddi Lee Harmon,Tue Aug 28 20:03:53 +0000 2018,Northern Nevada,nylahsays malcomx tried to warn us not to trust comedians and entertainers with politics dlhughley is one of those comedians that w,irrelevant
767,2857659911,Gloria Bain,Tue Aug 28 20:03:55 +0000 2018,None,scclemons moving noble very much hope that lindseygrahamsc lives in his political future by the standards in this powerful tribute,positive
768,700012184689049600,Eva Durn,Tue Aug 28 20:03:55 +0000 2018,None,mehba13462 maryamrajavi senjohnmccain cindymccain people of iranampits resistance lost great support he was against mullahs ruling,positive
769,947509891673051137,Owen Gibson,Tue Aug 28 20:03:55 +0000 2018,Arlington VA,senategop senators remember american hero senjohnmccain he will be missed,neutral
770,220631436,Frank Reid,Tue Aug 28 20:03:55 +0000 2018,Glasgow,channel4news realdonaldtrump senjohnmccain mccain was no innocent inside or outside of politics mind most defin,positive
771,111633969,Dave Davis,Tue Aug 28 20:03:56 +0000 2018,None,septembergurl if all of the coverage of the death of senjohnmccain is making you sad turn off morningjoe and cnn and put on fox,negative
772,704003885850095616,CyndiRocks1 ,Tue Aug 28 20:03:57 +0000 2018,None,alaskans4trump poll which best describes your personal view of johnmccain please vote amp rt mccainlegacy mccainfuneral,positive
773,3161544303,michael g newcomb,Tue Aug 28 20:03:57 +0000 2018,Ramsey il,dutyofapatriot mccain publicly asked that he not attend potus is respecting a dying mans last request its about mccain amp family no,neutral
774,1623946224,talimom,Tue Aug 28 20:03:57 +0000 2018,cheesehead land,malcolmnance im not crying youre crying goodbyejohnmccain,negative
775,1000096814165610499,Lin,Tue Aug 28 20:03:57 +0000 2018,Bridgeport NY,dearauntcrabby very lovely tribute to senjohnmccain by lindseygrahamsc do you really want to honor your friend john denounce re,positive
776,821866371088871425,Stephanie,Tue Aug 28 20:03:58 +0000 2018,New Jersey USA,1jeffwest danrather bibmomma3 lets be crystal clear about this african american nfl players do not protest the flag or the anthem,positive
777,873185940579078144,Paul Truett Dove,Tue Aug 28 20:03:58 +0000 2018,Palm desert ca,lindseygrahamsc will pay tribute to the life and legacy of my friend and colleague senjohnmccain today in the senate at 215 pm wat,neutral
778,733034572619767811,Christian Goodson,Tue Aug 28 20:03:58 +0000 2018,Texas Forever ,senategop senators remember american hero senjohnmccain he will be missed,neutral
779,180542862,SaveAslave ,Tue Aug 28 20:03:59 +0000 2018,USA,dutyofapatriot mccain publicly asked that he not attend potus is respecting a dying mans last request its about mccain amp family no,neutral
780,964572604110659584,w Tombs,Tue Aug 28 20:03:59 +0000 2018,None,magnifieri notice who has not been raided by mueller or the fbi clintonfoundation fusiongps christophersteele perkinscoielawfir,irrelevant
781,155040897,Becca,Tue Aug 28 20:03:59 +0000 2018,Washington DC,elizacollins1 the farewell letter from senjohnmccain to america,neutral
782,214715289,Maggie,Tue Aug 28 20:04:00 +0000 2018,Washington DC,senategop senators remember american hero senjohnmccain he will be missed,neutral
783,1159438243,Aeon Ravencrest#TheResistance,Tue Aug 28 20:04:00 +0000 2018,Dallas Texas,joncoopertweets the best way to honor senjohnmccains legacy and apparently his final wish would be for his wife cindy to be name,positive
784,29999155,Elizabeth Horton-Newton,Tue Aug 28 20:04:00 +0000 2018,T: 36.014668-83.968397,dearauntcrabby very lovely tribute to senjohnmccain by lindseygrahamsc do you really want to honor your friend john denounce re,positive
785,886539681478955008,flapjack,Tue Aug 28 20:04:00 +0000 2018,The Recent Past,kiranopal more recently johnmccain voted to block a deal to end american involvement in the increasingly genocidal saudiled campai,positive
786,16317071,Megan Healey,Tue Aug 28 20:04:00 +0000 2018,Harrisburg PA,ambberg flags at halfstaff above the pennsylvania capitol to honor the passing of senjohnmccain 82718,neutral
787,861465689948684288,Koki,Tue Aug 28 20:04:01 +0000 2018,None,mmarty1230 ditto ditto ditto did he not carry the fake dossier and hand it to someone acting like it was the real deal knowing it,negative
788,700012184689049600,Eva Durn,Tue Aug 28 20:04:01 +0000 2018,None,majedmajidy maryamrajavi senjohnmccain cindymccain people of iran will always remember senjohnmccain for his advocacy of freedom,neutral
789,789379092,Julie Loiseau,Tue Aug 28 20:04:01 +0000 2018,Austin TX,michaelsteele therickwilson senjohnmccain raging narcissism,neutral
790,1032983455297101824,Sharon Lovell,Tue Aug 28 20:04:02 +0000 2018,Sweet Home Alabama,sbpwidow senjohnmccain your military and veterans widows and widowers constituents and the rest of us across the country are sadden,negative
791,3746491,Michelle L. Quinn,Tue Aug 28 20:04:03 +0000 2018,#nwindiana,altuscis lindseygrahamsc crying on the floor of the senate remembering senjohnmccain it is the equivalent of faking a political o,negative
