744,aahhhgotchayeah we do need a sarcasm font although
116,the white house honoring johnmccain
128,in the early 70s i started wearing a powmia bracelet randomly my soldier was john mccain in 1973 i watched him on t
220,i hope the mccain family tell him not to show up at the service for he do
767,moving noble very much hope that lives in his political future by the standards in this powerful tribute
73,james1 she dont know shit about our needsall these years and she has
580,cindy mccain should immediately replace her husband until the end of his term as john mccain wished
688,rajavi my most profound condolences to the mccain family on the passing of he will always be remembered for his
390,and yet this man somehow equates kneeling at a football game as unamerican what is it that you are apparently pr
234,he wouldnt have lowered without the pressure being out on him even when he finally tha
995,hedges
418,we could really use a president johnmccain tuesdaythoughts
512,since johnmccain has left the hill the republican spines have gone with him former cia director
14,the best way you can honor your friend is to stand up to as he did show some g
388,you are not his friend u were not a friend stop with the bs already you are a kgb
85,greer did you attend seth richs funeral or did you just send flowers and debate questions
66,if thats how you interpret it i see it more as not just blindly following
669,johnmccain you were a sweetheart of bombs
844,go home kelly the people have spoken
650,i remember him crashing multiple planes
757,hero my a turncoat
838,the s will ram him through because many of them seem to have dirt clouds hanging o
106,insc spork if there is any truth to this i cann
636,senators remember american hero he will be missed
678,reminds us that wherever you live whatever you do that you can make a difference in the way the world tu
602,please replace johnmccain with a republican patriotic american not cindymccain or meghanmccain
487,what does it say about our system of government when people like you can help rig a primary and forward questions
8,the best way to honor legacy and apparently his final wish would be for his wife cindy to be name
